Comment,Club,Reply,comment_id,comment_parent_id
"Short term could be great (not sure if Klopp stays long after though) and long term, looking at PSG, I can’t get excited. We think we will be some type of an exception to other soulless, sportwashing clubs because we are Liverpool. It might take a bit longer but we will eventually get there.

Both our current (or most plausible at this point) options are not the best in the short and/or long term. It’s either rot away with FSG or become a sportwashing project for Qatar’s government right now. Watch a couple of random businessmen who have no issues investing but United though.",Liverpool,Yes,j7beyms,t1_j7ax8r8
Well to be fair the source also mentioned that we are in contact with QIA.,Liverpool,Yes,j7ay3h3,t1_j7awunp
Kostas has not performed time and time again lol what,Liverpool,Yes,j7bk7v7,t1_j7bh3yz
The only man I’d say is giving it his all at the moment is Robbo,Liverpool,Yes,j7bi3i6,t1_j7bh3yz
"Even with the Arthur deal I was optimistic because there’s a very talented player in there. The second he got a long term injury, we should have been pinging the phones of every midfielder on the market about a move, because if the stopgap you’ve signed gets injured, you’re back at square one but apparently no one at the club understands that.",Liverpool,Yes,j7aiqh1,t1_j7aiie6
"Didn’t he play in the hole when Chelsea had a 3 man midfield?

Either way, Jorginho specifically isn’t the point. I’m just saying that we should really have been looking at the deals other clubs are doing and try to jump in. Sabitzer is another example of a midfielder we just let fly past us",Liverpool,Yes,j7aimqy,t1_j7aikye
"Exactly. I’d be cautiously optimistic if it was any other team in the CL due to our pedigree, but we’re playing against the final boss.",Liverpool,Yes,j7bblix,t1_j7bbbia
"Despite how bad they are recently they still have a great midfield. If they still had Casemiro on top of everyone else, he would destroy all of our midfielders while Fabinho would get outrun by even Mariano.",Liverpool,Yes,j7cwx3w,t1_j7cwnfp
"We won't buy him lol, i was thinking barca or Madrid.",Liverpool,Yes,j7b2a3j,t1_j7b25tn
So you guys have 2 left wingers now with Diaz and gakpo?,Liverpool,Yes,j7b2ccg,t1_j7b1zh3
???,Liverpool,Yes,j7bes1n,t1_j7bencl
True. I agree he’ll be done in a year or so. I honestly wish we get Davies at some point. I also honestly don’t hate Tsimikas.,Liverpool,Yes,j7beyv3,t1_j7bes0e
"If we sign Gerrard. Then gods help you, Theon Greyjoy. Now you are truly lost”",Liverpool,Yes,j7ahxz9,t1_j7ahtyl
"No, when you have teams like Chelsea, city, newcastle and united around us.",Liverpool,Yes,j7acxfs,t1_j7acusb
Lol was thinking the same,Liverpool,Yes,j7bre1n,t1_j7bph0u
Sure?  He’s actually pretty decent at a long pass and one of the few mids who actually has a reasonable number of assists in recent seasons.  Our top assisters are almost always the forwards and fullbacks followed usually by Henderson.,Liverpool,Yes,j7c6q5l,t1_j7c0rur
You'll have a 433 and you'll like it!,Liverpool,Yes,j7c1p0r,t1_j7c0xzp
And he injured Diaz. One of the biggest blows to our season.,Liverpool,Yes,j7b7npo,t1_j7b6le8
Aren’t clowns funny?,Liverpool,Yes,j7bfjlf,t1_j7b956j
"Some people will never learn, man. There's still people going around who believe Mané was only on 100k til the day he left us. 

They have a story set in their minds and no fact is getting in the way of that.",Liverpool,Yes,j7ag6bh,t1_j7afbv1
There were rumours he felt unappreciated by the club who were making a fuss about Salah renewing. Could have been a bit of both: that and wanting a new challenge.,Liverpool,Yes,j7aggpy,t1_j7afbv1
"Key point is, we didn’t replace Mane with someone on his level. We got a striker who can’t score.",Liverpool,Yes,j7aff01,t1_j7afbv1
"Jesus has been injured all season, Nunez has not. Nunez is a striker, we have Mitrovic who has 10 goals in the league. We have Danny Ings who scored 7 goals in all completion, and he plays less games. Maybe we should sign him?",Liverpool,Yes,j7agbzd,t1_j7afzjy
"Yeah I know they can’t if it’s a yellow, just seems like a second yellow changes the game so much you’d want to make sure it’s the correct decision so allow VAR to check",Liverpool,Yes,j7c43ds,t1_j7c3qqy
His mobility has definitely improved since being in the prem. But yeah he’s not fast. Besides his technical ability he seems like a real leader to me and we sorely miss that right now as well. Given the athleticism of our front 3 if we have two more athletic players around him I think it’s fine. Fabinho when great for us was not fast or mobile.,Liverpool,Yes,j7aebbz,t1_j7ae14l
People mistake running around endlessly with playing good,Liverpool,Yes,j7as30u,t1_j7ar706
The narrative around Robbo shifts every time he puts in a decent or bad performance lmao,Liverpool,Yes,j7arvqc,t1_j7ar706
So has Thiago. More goals conceded from possessions lost than goals scored from chance creations.,Liverpool,Yes,j7av6x2,t1_j7ar706
"Can’t think of any tbh, it’s just an obvious corollary of the relationship between coach and players going toxic - one or the other must go. 

It’s far cheaper and - always will be - to bin the manager, whatever level of football you’re at. Maybe some extremely unusual outliers like Salford where they’re backed by a whole bunch of millionaires and play in a relatively low league could afford to bin out the squad instead of the manager I suppose, or Chelsea right now where they’re determined to spend as much as possible.",Liverpool,Yes,j7amhrd,t1_j7ahiov
"Arsenal maybe? 

They backed Arteta in getting rid of Guendouzi, Ozil, Aubameyang over attitude and mentality issues. I think they'd even just given Aubameyang a big new contract just months before Arteta wanted him gone. 

Also got rid of Mustafi who despite being a big investment was rubbish for them. And backed him in pushing Leno and Martinez out to bring in Ramsdale.",Liverpool,Yes,j7bjlgc,t1_j7ahiov
"your right. I think Mane leaving was the biggest factor tho, somehow sadio motivated salah to keep outdo him. kinda like how Suarez and Sturridge competed to outdo each other back in the SAS days. Since Mane gone mo doesn't seem so motivated anymore like he won the war and now enjoy the plunder. Neither Nunez or gakpo for that matter seem to motivate/inspire him to step his game up.",Liverpool,Yes,j7amaxx,t1_j7akjq2
they supposedly dont take money out though. And their profit (which only materialises when they sell percentages) will only grow as long as our valuation grows. Which it wont without significant investment and nobody is investing 400m without a controlling stake,Liverpool,Yes,j7adhvd,t1_j7acuyf
"Because they get money while still hanging on to one of their most valuable assets? If they don't get what they think is a large enough bid for the whole club, they're not going to sell up.",Liverpool,Yes,j7auix4,t1_j7angq6
"
He also had that interview where he accepted he was wrong tbf. That interview got him melo. 

Fsg seems done with the club ever since super league plans went out of the window. At this point they are just trying to spend as little as possible to run the club, therefore no dof, no club doctor and multiple people leaving.

It takes money to pay these people wages. But the media won't mention so they are nitpicking at everything they can. 

From Kornmeyer to Ljinders.",Liverpool,Yes,j7ckm21,t1_j7cjzor
"David Lynch and Mo chatra already referenced it, so it must be true. They are both well reputed to say something like that casually in the passing and that's good enough for me.",Liverpool,Yes,j7dk3ul,t1_j7dfxxg
"I think people project their own willingness to give up on other people.

Jurgen just a couple weeks ago said he had the energy for 10 more years. He isnt likely to give up like most of the fanbase. Its a hard job...tis why you appreciate the good times and dont act like a twat just because you finish second or lose a final",Liverpool,Yes,j7b44dy,t1_j7ayc6n
"It wont be untenable if nobody is asking for it. 

His job is to get the team back to stability. Right now, he is failing at that but it wont be forever.",Liverpool,Yes,j7b4bpt,t1_j7ayecg
"30 years in the wilderness...jesus. As if you were around for even a 6th of them.

Klopp 2 weeks ago - My motivation is no problem,"" Klopp said to BT Sport. ""I am a bit like Obelix, who fell in the… you know Asterix and Obelix? Ah, you don’t know it, forget it... I have enough energy for another 10 years if you want!”

But yeah, he'll walk. Some of you are such babies. The only good thing about a dry spell would be some of you bouncing to Newcastle.

Protest investment. Jesus, some of you",Liverpool,Yes,j7b88o8,t1_j7b7zie
Thought it was Chelsea away during queens death,Liverpool,Yes,j7blvqr,t1_j7blrsx
"It’s truly just a lack of effort imo. Call it fatigue, disinterest, coming down to earth after last season, I genuinely have no fucking idea. It’s probably a giant goddamn pie chart full of 2% bullshit reasons all over the board. However, one thing I always loved about our team is the effort. That is not there, and that is why we are even more frustrated.",Liverpool,Yes,j7ab4xp,t1_j7aazob
Hahah shes a keeper.,Liverpool,Yes,j7ab1d1,t1_j7aazdn
"It’s why we love them, but mate, fifa makes no one happy",Liverpool,Yes,j7ab106,t1_j7aazdn
Bringing on veterans to lock it down doesn’t work when the veterans cause most of the problems.,Liverpool,Yes,j7d0nqq,t1_j7c4twa
"it’s true but given the chances darwin has missed it’s just frustrating to watch . He’s not a player who can play like bobby and not a clinical finisher. 
he’s good in a team who sits back and counter attack",Liverpool,Yes,j7abgm7,t1_j7aaum5
That's a whole other story but in general I just don't rate him. When we signed VVD or Alisson as our big signings I totally got it but Darwin? I don't get it. He just isn't worth anywhere near what we paid him and there were so many better ways to spend that money.,Liverpool,Yes,j7acf2u,t1_j7aaum5
How many of those has he scored after taking a touch? Just gets the ball and shoots it straight like a moron,Liverpool,Yes,j7aasd3,t1_j7aaf3n
"I forgot about their academy. If they can produce high-caliber players like Gavi and more importantly retain them, then they'll definitely use it to their advantage and rebuild into their peak team.",Liverpool,Yes,j7d1cew,t1_j7d1153
And we will have only injury prone Matip right after his injury and Phillips at CB. And no subs,Liverpool,Yes,j7axne1,t1_j7axfqt
I hope so brother,Liverpool,Yes,j7csxb8,t1_j7csj60
"Hodgson was sacked with 25 points in 21 games. If we lose to Ev, its 29 from 21.

Roy is the bar",Liverpool,Yes,j7awjbq,t1_j7arv74
"yeah part of why i think that way is because all of these  stake news comes from Echo, which have been sort of FSG's boston globe; they report what FSG wants them to say. Regardless hope something gets sorted soon. The waiting game itself is exhausting",Liverpool,Yes,j7aesyn,t1_j7aejou
They had a week off after the Brighton loss and we thought it would wake them up……..,Liverpool,Yes,j7a7e5d,t1_j7a68zo
"Glad you’ve put that out there. Some fans have short term memory loss it seems. He’s due some criticism for his torrid performances, but we can’t negate what he’s done for us, applies to Klopp and many of the world class performers we’ve had over the years.",Liverpool,Yes,j7bsetm,t1_j7bqom0
"Trent is a right back and has been since he first came into the first team a big reason for his form is due to the system completely falling flat and having no midfield in front of him to help defend, he's not even getting over the halfway line anymore to affect the game in the final third.

Matips been poor this season but saying he isn't good enough anymore isn't right, once VVD is back and next to him he'll be better.

Gomez we kind of need to keep because he's homegrown, I'd rather sell him as well but what homegrown CB would we get in place for him?",Liverpool,Yes,j7b1qqz,t1_j7b0ucg
"Ahhh Kornmeyer the modern Achterberg. 
The evil scrupulous twat that sits in John Henry’s and Klopps ear and destroys every possible thing in our club. Manc probably trained a fitness coach for 10years in Muinch to infiltrate us and fuck our golden gen up.",Liverpool,Yes,j7ciy7m,t1_j7ce9hn
He’s making Klopp ignore the social media advice and it’s causing real friction behind the scenes and he’s insisting we make a MySpace,Liverpool,Yes,j7cj06t,t1_j7ce9hn
We were all watching these videos seeing our players happy and training in great form. Then along comes Fsg saying that posting these videos harms profits and banned this,Liverpool,Yes,j7ceymm,t1_j7cdzsy
Banned it here since the videos are only available on   Lfc Go which is a paid membership subscription,Liverpool,Yes,j7cg4o1,t1_j7cfc7n
"Most of the time it is with media though, gets clicks and outrages the weirdos",Liverpool,Yes,j7atb5i,t1_j7asgm3
Well I doubt you're going to get a lightning fast response on a Sunday afternoon. We'll see. To be fair if you read their previous statement in full I think this incident can be covered by that one too.,Liverpool,Yes,j7atksk,t1_j7asscj
Gapko has been fairly ineffective so far yep,Liverpool,Yes,j7bnfw6,t1_j7bminl
Reddy is a known shill for corporate owners. She’s been doing fluff pieces for the Glazers too. It’s a bit concerning FSG are trying to blame Klopp through the media.,Liverpool,Yes,j7at6zr,t1_j7aqyxz
"Almost like reddit posters don't know what they are talking about when it comes to tactics. My favourite complaint here is why does Klopp only play 433 he is so one dimensional and rigid. 

As if formations are a rigid thing on the field and people are told to stand in one area of field only, like people haven't heard things about interchanging freely  moving positional play.",Liverpool,Yes,j7b4sv6,t1_j7b4fp4
"Can't u see it here as well? They are so similar. And this is from the 2019 season.

https://preview.redd.it/tqeonxbutgga1.jpeg?width=1080&format=pjpg&auto=webp&v=enabled&s=a0f2219aef369c9279349e8be2e80cedf6f4077d

Also we are trying different formations and tinkering with salah positioning more this season, sometimes in 442 or 424. Also this is half a season of heatmap, Nunez, jota and Diaz coming back will change Salah position more won't it?",Liverpool,Yes,j7cgx8h,t1_j7cgkon
"Then there's last years where the change was made and thats a full year.

https://preview.redd.it/8dvsiw7itgga1.png?width=887&format=png&auto=webp&v=enabled&s=dc1ac35ce240b79d53b92a595f48ce65e6eb1653",Liverpool,Yes,j7ch2dl,t1_j7cgkon
"Neither did anything about Hicks and Gillet as well, just sat on the sideline and kept their mouth shut instead of supporting the local protestors. Pep Reina of all the people from the club called out the ownership.",Liverpool,Yes,j7awms4,t1_j7au8kd
"A protest has to have an aim or it's just a whinge. If your only tangible aim is ""Showing FSG they've ran us badly"" and then saying it's because of all of the other stuff they did but conveniently only takes place now we're shit then not only is it not going to achieve anything but it looks stupid too",Liverpool,Yes,j7ay01n,t1_j7attqx
"How does it matter if it’s a year old? Those accounts still exist. There was a lot of arguing here in the summer when we didn’t get a 4th CB. We then went and wasted an entire season, during which the FSG defenders had gone quiet. And yet that post was still made and hundreds of users still upvoted bootlicking comments despite of that horrible season. This past summer, people were supporting FSG whenever the midfield situation was brought up. We started the season poorly and the FSGin people either went quiet or went to r/soccer to complain about how whiny this place has become. Some of us have been here for years, we know how the clockwork goes. We’ll salvage something from this season eventually/hopefully, and the FSG asskissing will resume.",Liverpool,Yes,j7azl4j,t1_j7aypza
">outside of the goals Haaland offers them nothing

Thats true but at the end of the day scoring is what he's there for and he's scored a mad amount as well.",Liverpool,Yes,j7c1phx,t1_j7c1c9c
Dude he has banged in 25 goals for them. On track to demolish Salah's record. Pretty sure that's more than enough for him to offer nothing outside of just goal scoring.,Liverpool,Yes,j7cbezg,t1_j7c1c9c
Agreed,Liverpool,Yes,j7bi9vw,t1_j7bhxj2
"I’d say I’m being an extreme pessimist if I was to believe what I originally said. It makes no sense for either party, but regardless, RedBird have financial pressure placed upon the reliance and promise they’ve secured Milan fans of rebuilding a new stadium. Why on earth would that mean that they’d spend a billion on investing in FSG? Makes no sense. Also, your point about the debt is spot on. It’s all a hoax in my opinion, plus whatever they do has no bearings upon the sale.",Liverpool,Yes,j7bs4z0,t1_j7ba5e9
"The amount of debt we have is near insignificant to the size of what they seem to want to sell for though.  Seems to be a popular line, but any new owners aren’t going to be too fussed about our current debt levels.",Liverpool,Yes,j7bjqm5,t1_j7ba5e9
Funny goal post move tbh,Liverpool,Yes,j7b2eob,t1_j7azauc
We've known Bellingham would go for well over 100m for a year at the very least. Hasn't killed any Bellingham to Liverpool talk though.,Liverpool,Yes,j7azm0b,t1_j7azauc
"Oh I’m not, I agree with what you are saying, we should have got a midfielder. We were linked with Nunes and “couldn’t afford” to pay his release clause, we should have done that and got him in the summer. We should have added another midfielder in the winter window as well.",Liverpool,Yes,j7axyp8,t1_j7axj1m
"We clearly do have it to spend...its what its spent on. For example...they chose to spend 40 on Gakpo and not another position.

Included add ons...80+ on Nunez and not other positions. Whats the draw...seriously?",Liverpool,Yes,j7b3tzr,t1_j7ayu2g
We clearly do.,Liverpool,Yes,j7b3zuh,t1_j7ayiw0
"doesn‘t change it. jürgen has done more than enough to earn his go at a rebuild. sacking him would be the worst thing possible.  
i‘d rather sell each and every player.  
first fsg need to go, though.",Liverpool,Yes,j7alw39,t1_j7al4d7
"Ignore him he’s a plastic. Reality is Klopp had enough good wills in the bank right now, however he will need to start changing things.

We can cry until the cows come home about lack of investment yet the investment we have had has been misspent of late, we’re needed a midfielder for how long? We sign Gakpo in January. I’m sure he’ll be a fine player but he wasn’t needed, especially to play out of position.
I think Klopp gets until this time next year, if things don’t improve I think he walks to be honest. He looks like it’s all getting to him. 

Klopp has strengths that out weight his weaknesses but he used to have a team that mitigated he weaknesses, right now the clubs having endless shake ups behind the scenes, Klopp and pep seem to be getting more and more power, taking on more and more responsibilities and it does not work at all. 

We need to go back to what we were doing, everything was analytical and there were teams of people looking at players etc now it’s pep whispering to Klopp ‘Gakpo init lad fuck midfield’ it seems.",Liverpool,Yes,j7avfph,t1_j7al4d7
Middlesbrough and Burnley I’d recommend,Liverpool,Yes,j7adh8p,t1_j7ab8el
"Without meaning to sound cringey. Liverpool is a different club to most and Klopp is a different manager to most. 

If Klopp was sacked and it wasn’t what was wanted by the fans. It wouldn’t end well for FSG. And they know that.",Liverpool,Yes,j7bca55,t1_j7b1lg0
But LOL giraffe memes lol,Liverpool,Yes,j7asyje,t1_j7ar8tc
"No one can actually explain how Matip was apparently better than VVD over the whole of last season (which ended in Matip getting demoted behind Konate). The Matip > VVD narrative was actually started by rival fans last season to try and discredit VVD’s legacy and it ridiculously got parroted by some Liverpool fans I guess wanting a hipster opinion.

Edit: point proven, whoever is downvoting me how about you try and back up your opinion?",Liverpool,Yes,j7arheo,t1_j7ar8tc
"The game of football is fun. Just because Liverpool are crap, it doesnt mean the wider game isnt fun.

Goring up has everything to with it. Sometimes your team is bad…deal with it. Makes the good days even better",Liverpool,Yes,j7c0eas,t1_j7byr9r
He was marked out of the game. City's only approach was wide or through the midfield and neither of them worked.,Liverpool,Yes,j7c6tq1,t1_j7c6j2j
We should infiltrate the mod group and take it down from the inside,Liverpool,Yes,j7dcs7g,t1_j7dad94
"Yes but Red bird is more likely to happen though, as it already has happened before and their money is shady as far as I know. So it's kinda hypocritical of the OP to be concerned about one thing while the other thing is more likely to happen for real.",Liverpool,Yes,j7ayd8c,t1_j7ay3h3
"… And he’s not looking great either. Attitude-wise he does seem up for it, performance-wise meh sadly.",Liverpool,Yes,j7bkovz,t1_j7bi3i6
"maybe because they had no one else because of injury.  
he isn‘t strong or fast enough to be a real cdm.  
  
i do think that we should‘ve bought a midfielder, don‘t get me wrong, we desperately need help there, but jorginho wouldn‘t have been the move imo.",Liverpool,Yes,j7aiu3n,t1_j7aimqy
It’s not that you wouldn’t buy him but he wouldn’t wanna go 💀,Liverpool,Yes,j7b6v1q,t1_j7b2a3j
"Yes, which should be the bare minimum for any squad who wants decent depth in attack.",Liverpool,Yes,j7b2me6,t1_j7b2ccg
"Yes, but Gakpo has been playing central a lot so they seem to be planning to use him there potentially.",Liverpool,Yes,j7b2nrt,t1_j7b2ccg
"I’m saying Torres isn’t worth it. They are better RW options, specifically back up to Salah out there in the market.",Liverpool,Yes,j7bew3q,t1_j7bes1n
As if we are ever gonna get Alphonso Davies. Be realistic man,Liverpool,Yes,j7bfx87,t1_j7beyv3
"Only city and Newcastle are state owned ?

Edit - il make this clear aswell, I am FSG out

But I think it's not oil money or FSG there's alternatives",Liverpool,Yes,j7acz99,t1_j7acxfs
"""DARWIN NUNEZ COST LIVERPOOL 8 BILLION POUNDS I DONT CARE HOW MUCH EVIDENCE CONTRADICTS MY OPINION""",Liverpool,Yes,j7agx2c,t1_j7ag6bh
"10 goal contributions in just over 1200 minutes (league and CL) for a team in this state isn’t that bad though 

The forward line with Diaz, Jota, Darwin and Gakpo all 26 and under is the least of our concerns now",Liverpool,Yes,j7afswz,t1_j7aff01
Ffs mate Diaz is Mane's replacement. Just because Diaz arrived when Mane was still here doesn't mean Darwin is meant to be the new Mane. Diaz was meant to be bought last summer but the deal was brought forward because of Spurs' interest,Liverpool,Yes,j7ag08s,t1_j7aff01
I don’t think you know what you’re trying to say here. You literally ignored every point I made because you know I’m right,Liverpool,Yes,j7agizu,t1_j7agbzd
"For me he’s been notably worse for the last two years and ive been saying it the whole time. He started last season great and then fell off massively, same with this. His passing has turned to absolute shite and he’s not as solid defensively.",Liverpool,Yes,j7atey0,t1_j7arvqc
"Yeah, especially as you'll not likely sell the under performing players for much money",Liverpool,Yes,j7b7jnv,t1_j7amhrd
"Certainly a good example of a club sticking by a manager, but it's not really the same situation.

I'm more thinking of when a manager has been at a club for a while, and then things turn. Usually around the 3rd season these days.",Liverpool,Yes,j7bs1d4,t1_j7bjlgc
"Tbh if i was nunez or gakpo watching 1 of senior with 0 motivation, half assed press and still play regularly it definitely effect the mentality..",Liverpool,Yes,j7aobkt,t1_j7amaxx
Klopp wasn't sacked from Dortmund. He walked ya know.,Liverpool,Yes,j7b9q7j,t1_j7b44dy
"Yeah because everything someone says to the media is always 100% true and people never change their minds. If he does choose to walk, I know it will be an *extremely* difficult decision for him that he will discuss with his wife and family first. 

I hope he doesn’t walk and wanting to be optimistic, I don’t think he will.",Liverpool,Yes,j7bd9m5,t1_j7b88o8
"Anything before the world cup was 20 years ago, so I can't really remember which one was delayed first",Liverpool,Yes,j7breqt,t1_j7blvqr
Name me a more toxic game community. The super grindy game mode makes people extremely bitter. If I had a dime every time my opponent quits when I have the winning penalty...,Liverpool,Yes,j7akrt2,t1_j7ab106
"You're right, I was clearly delusional from the loss",Liverpool,Yes,j7ab4y9,t1_j7ab106
Here here,Liverpool,Yes,j7d1he0,t1_j7d0nqq
"He is scoring goals in a shit Liverpool team, so piss off. You have no answers, just dragging players down. Nunez has been one of the few sparks in this team this season.",Liverpool,Yes,j7aaz4v,t1_j7aasd3
"Gomez is an awful centre back anyway, doesnt really matter if we wouldtn have him as cover",Liverpool,Yes,j7axwkw,t1_j7axne1
It’s the only thing we have left this season so I’m just gonna convince myself we have a good chance of going through if we put in a big performance at Anfield,Liverpool,Yes,j7ct29m,t1_j7csxb8
Yep that's why I've nearly lost all hope and genuinely not motivated to watch the games until some positivity comes,Liverpool,Yes,j7a8en0,t1_j7a7e5d
His influence knows no bounds. He is the dark lord Kornmeyer.,Liverpool,Yes,j7cje66,t1_j7ciy7m
