Comment,Club,Reply,comment_id,comment_parent_id
It's mad how Chelsea spent so much but you see the starting lineup and it still looks weaker than many other teams,Liverpool,No,j73qsj6,t3_10scsij
Looks like Chelsea took all the money out of the groundskeeping department,Liverpool,No,j73tjmk,t3_10scsij
"I used to say this about Klopp, but if Im a player in a “smaller” team, Id be playing out of my skin anytime I now face Chelski. Especially with Todd in attendance lol You never know if you may be the next 100mil signing 🤣🤣",Liverpool,No,j73u013,t3_10scsij
"Good man Harry Wilson, taking out the snake",Liverpool,No,j73vv2m,t3_10scsij
"So I was born in 96 so my dream teams based on the players I've seen playing would be 4-2-3-1:

Alisson

Robbo, Van Dijk, Carra, Trent,

Gerrard, Alonso,

Mane, Suarez, Salah

Torres

Agree, disagree? Whats your dream team?",Liverpool,No,j74uoeo,t3_10scsij
Chelshit spend all that money only to end up still playing Havertz as their striker.,Liverpool,No,j750wp5,t3_10scsij
I dreamt that we resigned Suarez and went on to win the CL,Liverpool,No,j70t712,t3_10scsij
Yeah we might suck but at least we didn't spend 600m in 6 months to still suck.,Liverpool,No,j73y9k9,t3_10scsij
Might be an unpopular opinion in this sub and I don’t want to sound like I’m scapegoating him but I wouldn’t be opposed to Lijnders leaving this summer. I think it’s time for a refresh.,Liverpool,No,j72oupa,t3_10scsij
"why is John Henry the only one whos name gets thrown around? He is the owner with most shares, sure, but I've never read that he is either hands on or most involvee in how FSG operates.

You have: Tom Werner, (chairman), Mike Gordon, Peter Moore (Chief Executive), Michael Egan (director) and Andy Hughes (chief operating officer), Billy Hogan (Chief Executive Officer). 

Then there is also Julian Ward, sporting director, one of the key functions in the club, guy didn't even want the job lol, and is leaving at the end of the season.

Point is, there is much more to everything than just ""stinginess"".

LFC was lauded as a brilliantly run club which I agreed with, but we have imploded certainly on many levels. And stuff like this also surely had an impact on the players itself.",Liverpool,No,j713xl9,t3_10scsij
"Who are the hot young right wingers in world football right now ? 
I'm not calling for a Salah replacement.... but pipeline, who would be in the works ?",Liverpool,No,j71zivj,t3_10scsij
Wtf AM i doing with my life... Wantching Weston Mckennies first day i Leeds video... Shit van though.,Liverpool,No,j73cc3f,t3_10scsij
Not saying sign Gallagher but his engine and press is exactly what our midfield is missing same with Paulinha.,Liverpool,No,j73trjk,t3_10scsij
How bad is Havertz,Liverpool,No,j73vm66,t3_10scsij
Fulham are a tidy side,Liverpool,No,j73wcmt,t3_10scsij
"Boehly's gonna need to spend another half a billion, me thinks.",Liverpool,No,j73wed8,t3_10scsij
And again its on full display that one new midfielder can only do so much (unless theyre prime xavi or modric or someone like that).,Liverpool,No,j73xd00,t3_10scsij
I remember losing sleep catching games at 3am here on a weekday. Now even a 11pm game on a Saturday feels like a chore..,Liverpool,No,j757c0h,t3_10scsij
"For anyone interested in health and fitness, this video on Haaland's diet is good:

[https://www.youtube.com/watch?v=\_rK9rTDPiW8](https://www.youtube.com/watch?v=_rK9rTDPiW8)

He's definitely aiming to be the absolute best

Video from Derek - *More Plates More Dates*",Liverpool,No,j71h6u1,t3_10scsij
"Just had a dream where Newcastle signed Bellingham, and we spent the entire summer buying no one, just a RW player on loan. It’s a nightmare, but there may actually be a world where this is true",Liverpool,No,j70ygx3,t3_10scsij
"I fully expect that Boehly hasn't really understood anything about overspending in the premier league, and Chelsea will get nailed to the wall, somewhere down the line.",Liverpool,No,j72cl2q,t3_10scsij
Gee I wonder how much is Arsenal’s net spend considering that they can extend contracts and sign players in the same season?,Liverpool,No,j7392if,t3_10scsij
fair play boehly actually goes to watch games,Liverpool,No,j73u072,t3_10scsij
"Call me crazy to say this about a loss to Brighton but I saw some shoots of recovery last saturday that I'm hoping we can build on. It wasn't anywhere near as bad as the league game and until the subs we actually didn't look completely awful.

Thiago, Keita and Bajcetic in the middle is a must for as long as they all stay fit, and I know Klopp is trying to play Fab out of this awful form he's in, but he shouldn't be getting minutes until games are secured for the timebeing.

Hopefully Nunez, Gakpo and Salah can all start tomorrow against Wolves, and the back 4 sadly picks itself. Gomez and Matip need a BIG performance against a struggling side to allay any worries going into our big February games.",Liverpool,No,j718b8v,t3_10scsij
Lol I'm all for Everton's new manager bounce to beat Arsenal at Goodison. What kek that would be.,Liverpool,No,j71q5ro,t3_10scsij
"I’m as uneasy about the departures going on behind the scenes as most but why does it seem like some of the data lads on twitter are taking it personal?

If you didn’t know any better you’d swear Jurgen lucked out massively since he’s been here and the recruitment team carried him. Not trying to downplay their input btw but I’m seeing some real strange takes about Klopp and it’s not sitting right with me. He’s been the most important man at the club since he walked through the door and that hasn’t changed",Liverpool,No,j73auhf,t3_10scsij
Enzo got a lot of praise and rightly so but Palhinha impress me more.,Liverpool,No,j73nxnh,t3_10scsij
My day is made,Liverpool,No,j73wcw2,t3_10scsij
Even when Potter was at Brighton they could hardly buy a goal,Liverpool,No,j73wgb7,t3_10scsij
 Tete was a beast,Liverpool,No,j73yazv,t3_10scsij
Both Bacjectic and Morton (plus Bellingham!!) - seen a few random comments Morton has been doing well. Chance both will have future here and playing in first team together in some way shape or form in the future alongside Bellingham (hopefully) ??,Liverpool,No,j74e3ue,t3_10scsij
"I have forgotten completely why we wanted havertz

What does he do",Liverpool,No,j73vygt,t3_10scsij
"I know everyone seems to think we won't spend any money in the summer but there's a clear indication we are going to spend at least £150m, we know we want Bellingham and clearly are whilling to pay whats needed for him or else we would'nt be constantly asking about his situation like reports say and we also know through tier 1 midlannd reporters that we will go for Nunes and Wolves want £50m for him so I think we will genuenly spend a lot this summer.",Liverpool,No,j73wn9a,t3_10scsij
FSG out by the way,Liverpool,No,j714300,t3_10scsij
"IndyKaila up to his fried chikkin nonsense again. It's amusing as hell tho! Hahaha

Exclusive: According to #Liverpool sources, civil war is brewing between Liverpool principal owner John Henry and Reds chairman Tom Werner

Qatar-based investment fund have submitted a takeover offer for #lfc & Tom Werner wants to accept the offer & John Henry is blocking the bid",Liverpool,No,j70shsm,t3_10scsij
"Unpopular opinion: Robertson is having a stinker of a season, but fans don't want to admit it because they like him. Now, of course he is far from our biggest issue, but just because others are worse, doesn't mean he is good. Bad tracking, bad in 1vs1, wayward crossing. Trent gets slandered but imo he isn't far behind.

Also to be honest the goal in the champions league final is on him and not Trent. He was walking in the midfield, letting modric to make to play unmarked and never returned to track Valverde",Liverpool,No,j70vrxx,t3_10scsij
Chelsea are vaporware. All of you are circle jerking over net spend. They will end the season having spent half a Billion to get worse.,Liverpool,No,j741yyh,t3_10scsij
"It's a tough time, but if anyone can get something out of this midfield, it's Kloppo. Let's keep believing",Liverpool,No,j71ixs8,t3_10scsij
"I know it's taking time, but the performance from Chelsea after the circle jerking here was pretty good.",Liverpool,No,j73zoma,t3_10scsij
"£20m for Palhinha to a newly promoted Fulham and we are stuck with the likes of Henderson and Jones in midfield.

Our transfer team have lost the plot honestly.",Liverpool,No,j73qwtb,t3_10scsij
Absolutely mad I went to school with Lawrence Stewart who Boely brought in from Monaco as a director. Just seen him on the tele!,Liverpool,No,j73v34h,t3_10scsij
What they’re saying on sky sports about too much power at Kirkby is so worrying,Liverpool,No,j71j9ck,t3_10scsij
"Mount is actually shit. He genuinely wouldn’t get in  our midfield ahead of Bajcetic, Thiago and Keita at the moment",Liverpool,No,j73hugm,t3_10scsij
I refuse to believe that klopp had some order 66 type shit waiting to force out all of the guys who made us the best team in the world. He has always enjoyed working with directors and other people so why would he suddenly eliminate like four other departments in one swoop,Liverpool,No,j727m2z,t3_10scsij
Wouldn’t touch Mount with a 10 foot pole,Liverpool,No,j73xjmk,t3_10scsij
Fulham have been so good this season,Liverpool,No,j73svkg,t3_10scsij
"I get the thinking of playing Enzo as the lone no.6 in possession. It’s like what Bayern did in the UCL run in 2020. You have to make sure the other midfield players are tireless runners. Just watch Thiago in any of those games especially his positioning. Goretzka was a runner while Thiago was sitting in front of the defence dictating play and putting in his classic tackles that we are accustomed to. Muller is basically positionless but was still running in that midfield as well. If we were to ever run that experiment, we would need actual runners in midfield again. I see how it could work with Chelsea with Enzo because Mount and Gallagher are runners, unfortunately they are aren’t the smartest type of ones if you get what I mean",Liverpool,No,j73t0zh,t3_10scsij
Boehly-cam is beyond tedious,Liverpool,No,j73txxk,t3_10scsij
Tete guy is really good. Workhorse today.,Liverpool,No,j73uln6,t3_10scsij
Can we have a stickied injury list pls? Or is there one that I’m not seeing? So hard to keep up with lol unfortunately,Liverpool,No,j75cfry,t3_10scsij
"https://www.instagram.com/p/CoKo2R9ozf4/?hl=en

Kenny's daughter/granddaughter definitely dressed him yesterday",Liverpool,No,j75k6a0,t3_10scsij
"You guys just don't understand that there were no midfielders available, except for Caicedo, Fernandez, Nunes, Ambrabat, Bellingham, and Mount, but that is it.",Liverpool,No,j72y6k8,t3_10scsij
"At this point I'd give Sepp VDB a chance over Gomez next season. He's much younger, is going to count as HG starting next season and has shown signs of actual progress in the last few years, and can even deputise at RB like Gomez. Whereas Joe has never recovered his form from 2018-20. Imo he's run his course at this club and we'd do better to start shaking up things at the CB front as well, before the rot settles in.",Liverpool,No,j70zq3a,t3_10scsij
"https://preview.redd.it/n83xy5zjmzfa1.jpeg?width=500&format=pjpg&auto=webp&v=enabled&s=6c3213ef928a15bc9af76daea13a505dbafdf317

Day 21 of posting this until we sign someone,

We need a time skip",Liverpool,No,j718abx,t3_10scsij
"https://twitter.com/dankennett/status/1621484412826173441?s=46&t=VtlPpZNhWohcc8DGSk-PVw 

Twitter detectives were right but constantly shat on cause there was no Joyce Article, lol. So so obvious. In case it still isn’t obvious to some because it’s not been spelt out, we lost Edwards due to Klopp getting to much power. Hendo’s extension fked everything. Losing Edwards is bigger than anything.",Liverpool,No,j71piy7,t3_10scsij
"According to Christian Falk, Dortmund have a suitable benchmark for Jude and he will not go less than Enzo’s fee. Which was always going to be the case. He specifically mentioned it in regards to Liverpool and them now knowing what they need to bring to the table. 

This was on Fabrizio’s round up email.",Liverpool,No,j71y0dp,t3_10scsij
Palhinha would be great for us,Liverpool,No,j73vnp5,t3_10scsij
Bruh can we just throw £50m at Palhinha or some shit.,Liverpool,No,j73r505,t3_10scsij
"Ok hear me out, our midfield might have lost its form but we still have a healthy Thiago and Keita who can be brilliant. Bajcetic has shown some amazing potential as well. 

I honestly think we are due a game where it all clicks. Hoping it’s when United comes to town.",Liverpool,No,j70wmqf,t3_10scsij
I would be lying if I were to say the Enzo to Chelsea deal still doesn’t hurt. He is a no.6 that has excellent ball playing skills.,Liverpool,No,j73j42v,t3_10scsij
[deleted],Liverpool,No,j70s03j,t3_10scsij
Anyone know what’s happening with Musialowski? He scored a fantastic goal for the U-21’s and has been impressing in the youth ranks for a while yet hasn’t gotten a sniff of first team football. He looks super talented,Liverpool,No,j72yodh,t3_10scsij
"It’s genuinely incredible how badly this season is going. I really can’t imagine how it can get worse , although I’m sure I’ll be proven wrong",Liverpool,No,j74u05x,t3_10scsij
Does anyone know what the fuck happened to Fab?,Liverpool,No,j71gtxq,t3_10scsij
[removed],Liverpool,No,j72v9kd,t3_10scsij
"Wasn’t long ago Klopp was mentioning Martinelli in his press conferences and it was thought he could be attainable. Contract to the Goons to 2028 now. 

I’m wonder what f he ever pushed for it but FSG didn’t bother given it would have been a big fee to convince Arsenal.

Is Bellingham really coming ?",Liverpool,No,j71dcnb,t3_10scsij
"if gakpo and nunez start tomorrow and gakpo is playing as a striker we need to start questioning klopp, also there is no need to change the midfield let bajcetic thiago and keita continue doing their thing for now.",Liverpool,No,j74bmxc,t3_10scsij
"I don’t even remember how Diogo got injured, anyone care to freshen up my memory?",Liverpool,No,j722z1k,t3_10scsij
"If anyone coming to the end of their contract gets an extension, I hope it’s him. He offers so much in terms of leadership. Some sort of coach/player agreement. 

https://www.liverpoolfc.com/news/james-milner-wolves-clash-utilising-experience-fighting-spirit-and-more",Liverpool,No,j71b562,t3_10scsij
At this moment it’s hard to see how we beat Fulham imagine saying that a year ago,Liverpool,No,j73qdqg,t3_10scsij
"We should buy palhinha in the summer with Jude, that would be perfect",Liverpool,No,j73qvqt,t3_10scsij
Fulham and Chelsea putting on a good show. The Cottagers have been really impressive and their signings all have made a positive impact. Chelsea still need to fit all the pieces together but can be potentially dangerous down the road once everything clicks.,Liverpool,No,j73vsm2,t3_10scsij
"Will people look back on this era as the era that City dominated and we were the only side to run them close? Or will they look back on this era and see both teams as the two sides that dominated?

Kind of hard to call it imo, with all trophies and relative spending power considered.",Liverpool,No,j7432s6,t3_10scsij
"Just had a thought that fan base has collective trauma from the Paris final incident. Took a massive toll on the vibe. Still haven’t recovered. Not that I was there, I just can’t imagine.",Liverpool,No,j72e50z,t3_10scsij
"Not one person’s gonna agree with me on this but Loftus-Cheek on the cheap with a year left on his contract would be a decent signing. Strong, has legs (that work), tidy on the ball with prem experience and homegrown. Not saying he’d transform our midfield but he’d be ideal sort of player to plug constant injury gaps in our midfield when they arise",Liverpool,No,j719py8,t3_10scsij
"World class players:

Defence:

Allison

VVD

TAA

Robbo

Midfield:

?

Forward:

Salah 


We need Nunez to step up to help Salah and at least one world class midfield and we'll be set. Most of the spine is still ok. 

Unfortunately we thought Thiago would be world class but he's not, he can't change a game like KDB or Gerrard.",Liverpool,No,j70zawg,t3_10scsij
fulham have some electric passing,Liverpool,No,j73pjei,t3_10scsij
How's Enzo playing?,Liverpool,No,j73uuuj,t3_10scsij
Reed's pressing has been so good,Liverpool,No,j73v6be,t3_10scsij
I was looking there for the 2005 final on YouTube and the one I always used to watch (the one with the song from gladiator) is gone. Anyone know where I can find it these days?,Liverpool,No,j74e8c4,t3_10scsij
"For fuck's sake, Arsenal ...",Liverpool,No,j76kw6y,t3_10scsij
"Unpopular opinion on this sub but I am going to go ahead and say it - Losing Mane has had a deeper impact on our team than we are able to admit. Sure we replaced him with Diaz but Mane was still only 30, never got injured and pressed relentlessly. Work rate was unmatched day in and day out even if he played like shit and had 20 goals or so in him  each season just in PL. Whatever Klopp hoped Gakpo would do (press up front or whatever he said last week), Mane was already doing and more. Should have just paid him the same wages as Salah, and used Gakpo money on a mid fielder.",Liverpool,No,j72fr3z,t3_10scsij
[deleted],Liverpool,No,j73n8oy,t3_10scsij
We should go for Palinha and Anguissa from Napoli in the summer if we're remotely competent,Liverpool,No,j73ymdd,t3_10scsij
"Klopps quotes re Chelsea’s spending has me very worried that he was never that bothered about being backed anyway, and truly believed we’d be okay with the current squad",Liverpool,No,j71imv3,t3_10scsij
Adolf Mount?,Liverpool,No,j73rqgb,t3_10scsij
"- Liam Neeson (The Grey, 2011)",Liverpool,Yes,j70qssy,t1_j70qaw7
I’d go as far as saying it’s the biggest summer for Liverpool in the PL era.,Liverpool,Yes,j722oql,t1_j71r447
"On the flip side, if he was winning he could say it was with players he didn't pick, if he loses he can says it's not his team so it works both ways",Liverpool,Yes,j7464pu,t1_j742r6l
"I must admit, I may be misremembering from his early days at Liverpool, Dortmund, Mainz etc but I don't ever remember hearing him speak so plainly about effectively dropping a player and having him work his way back into the team.",Liverpool,Yes,j71lama,t1_j71k8se
What exactly did he say? I’ve not had chance to watch yet,Liverpool,Yes,j71lwvd,t1_j71k8se
Do you hav a link/summary of the conference?,Liverpool,Yes,j71mfkx,t1_j71k8se
They’ll probably go and throw 100m at Osimhen in the summer,Liverpool,Yes,j73ytl2,t1_j73ynb9
they already signed Nkuku,Liverpool,Yes,j74tupy,t1_j73ynb9
"We're a shitshow from head to toe atm, got to wonder if a lot it influneced by the fact the club has been put up for sale.",Liverpool,Yes,j72684r,t1_j725sqm
">  Thiago, Bajcetic, and Caicedo. Or Thiago, Baj, Caicedo",Liverpool,Yes,j732k0i,t1_j731nv5
"They’ve checked out. Anyone who believes FSG are committed to the club and its future needs to understand the fact. The fact is that if the summer budget for a revival and a rebuild was promised by FSG themselves, you’d surely get in a midfielder to help aid the top four ambitions we have at the club, but that wasn’t done hence their unwillingness to spend a dime on the midfield. Not even a loan signing like United resorted to. Lynch’s article is being referenced in what I’m saying but that’s what it simply is. Negligence and unwillingness due to their withdrawal of things at the club, and how a sale is looming inevitably large at the club in the next few months. Reports coming out a today looking for a new scapegoat and confirming that things are unjust behind the scenes just emphasises the lack of care FSG have shown over this season. They’re only concerned about their paycheck at the end of this.",Liverpool,Yes,j73nast,t1_j731nv5
I think that's for the better,Liverpool,Yes,j71jiqt,t1_j71c9qh
That old geezer Willian even has enough of an engine to constantly help out his midfielders. They’ve been the better side so far!,Liverpool,Yes,j73nweu,t1_j73lbfb
Imagine being the decision maker behind giving those who are incapable of running an extension. We simply haven’t replaced those who have been ran into the ground.,Liverpool,Yes,j73mlx5,t1_j73lbfb
"The thing about Jota is that last season he often had games where he wasn’t playing great, but he’d still bag a goal. Now he’s the opposite. He isn’t scoring much, but he’s having a huge impact regardless.",Liverpool,Yes,j7335ya,t1_j72zcgx
"Can't make Liverpool come for him, loads of big teams passed on Palhinha and eventually he just took any PL club.",Liverpool,Yes,j73h0js,t1_j73gl2u
Theyll probably try to sign Tuchel back for 100mil,Liverpool,Yes,j73u3qr,t1_j73sdeh
"It's going to take a while for their players to gel. Their players will need time, just like how it's unfair to judge gakpo on 4 games and Nunez on half a season.

Edit- do agree though shouldn't of sacked tuchel",Liverpool,Yes,j73sv3d,t1_j73sdeh
Lots of new players without a pre-season under them will make a team lose coherency and identity — especially when those new signings are thrown in immediately without fluency in the system.,Liverpool,Yes,j73sp95,t1_j73sdeh
Is that good or bad ?,Liverpool,Yes,j71tb5w,t1_j71q79t
ah the (D)iaz (D)arwin J(o)ta (S)alah DDOS 424 line up,Liverpool,Yes,j71134i,t1_j70zo1n
"Either:

Too much power in the market has been given to people like Lijnders 

or

They want to make specific signings but arent given the money to do so.

Or a mix of both.",Liverpool,Yes,j72hiej,t1_j71rlr3
Ward didn’t even want the job originally and the person who convinced him has left to oversee the sale,Liverpool,Yes,j71s244,t1_j71rlr3
Excited to see how Enzo does in the PL but I hope him and mudryk flop like the rest of their big signings so they’re stuck with overpaid benchwarmers for the next 8 years.,Liverpool,Yes,j72og10,t1_j72iigw
"I used to feel the same about Haaland and that bastard Silva, but it's easier now we aren't competing with them. Which is also shit. Arsenal leading them helps though.",Liverpool,Yes,j72s3ef,t1_j72iigw
For me it's an absolute necessity to not lose the first game at home to have some hopes,Liverpool,Yes,j70wa6h,t1_j70vlyj
"Well we are only out of form,  our starting team on paper is still plenty capable on the right day.  Gonna happen on one of these games soon.",Liverpool,Yes,j70ymy8,t1_j70vlyj
We are literally becoming the same Man Utd we were all laughing at last season,Liverpool,Yes,j71r2a9,t1_j71m19g
i searched her name and saw rumours shes dating mane? lol,Liverpool,Yes,j71mz7m,t1_j71m19g
"> Kornmayer 

This isn't down to a single person. If it was, the club would've sacked him by now. It's not as though one man can hold a club hostage without anyone noticing. 

> very very smart people 

Unfortunately, having been in multiple industries, this isn't always true. We begin to idolise people on this sub because we hear their names in positive news, but the truth is we know absolutely nothing about Edwards or Ward beyond small pieces. They could be incredibly intelligent or, simply, normal human beings who've found themselves in privileged positions and want to move elsewhere. None of this needs to be a portent of doom.",Liverpool,Yes,j72q36u,t1_j726af6
Gakpo assist or goal would be lovely too - really want him to kick on and get some confidence going.,Liverpool,Yes,j72g9j3,t1_j72dn41
I don't think it's greedy to want Darwin to score. The universe owes it to him and to us,Liverpool,Yes,j72t80p,t1_j72dn41
They'll need a long time to gel the team and make them into a unit,Liverpool,Yes,j73wgn1,t1_j73w5jc
Heard Arsenal are after both of them,Liverpool,Yes,j73z9l6,t1_j73yucj
VVD was coming in the summer before we messed everything up the sale of him funded that summer window so the likes of Fab and Ali,Liverpool,Yes,j71q9ue,t1_j71puil
"We tried to sign him before the Coutinho saga began. There was that Blackpool debacle that delayed it 6 months. 

It’s the Alisson and Fabinho transfers that are more relevant.",Liverpool,Yes,j71q99z,t1_j71puil
"He and Allison were basically funded by the Coutinho sale, yes.",Liverpool,Yes,j71q4j3,t1_j71puil
Yeah where the fuck are their new signings?,Liverpool,Yes,j73rw2x,t1_j73qsj6
Our approach and Chelsea’s approach the complete polar opposite in non-sensical transfer window approaches,Liverpool,Yes,j73yio6,t1_j73y9k9
But instead we're gonna get a Milner extension and an interview with Lijnders about how Koopmeiners is the missing link,Liverpool,Yes,j72x9js,t1_j72oupa
"Although I agree; klopps struggling to bin players he loves, it'll take something catastrophic for him to ditch pep who he clearly loves more than anyone else in the club.",Liverpool,Yes,j72y5sa,t1_j72oupa
"Coming in for support before you get downvoted like I was.

100% agree. We need a stronger tactical guy beside Klopp.",Liverpool,Yes,j72sqei,t1_j72oupa
Seen plenty of stuff being written about Kornmayer as well... Things do need to change that's for sure.,Liverpool,Yes,j72rbm6,t1_j72oupa
"Honest question: Why? Pep's been an important part of our past success as the assistant coach and while he retains some influence with regards to transfers, it's not like any of the ones he was linked with are bad necessarily. Diaz, Gakpo, and Nunez are all *good* players, with Gakpo and Nunez being overpriced quite a bit, mostly due to interest from elsewhere. 

I really don't understand the calls for their sackings when it's clear that the entire club is suffering from some kind of hangover from last year.",Liverpool,Yes,j73ky6l,t1_j72oupa
