Comment,Club,Reply,comment_id,comment_parent_id
"Since we decided to do fuck all, what are some quick in house fixes you think could improve performances. 

I will sadly have to rule out inhalers",Liverpool,No,j6r1zg0,t3_10qm41m
Can we go back to New Balance kits please? I think Nike kits is bad juju.,Liverpool,No,j6sgrkx,t3_10qm41m
"The thing that I find most perplexing is I just don't get from a business perspective letting the first team erode.  By strengthening the squad, there are both short and long term benefits.

You get a 20ish games for the player to bed in and integrate into the squad.  It's one less player to buy during the summer.  If somehow everything goes well, you can make a push to get back into the CL, which is a MAJOR financial incentive worth somewhere between 50-100m.

The market isn't going to get more sane.  100m+ for Enzo was seen as a ridiculous price and in the end, Chelsea paid it.  50m for Caicedo this summer was deemed way too much for a player with such limited first team experience yet 6 months later, 60-80m was deemed a price 2 clubs were willing to pay.  The market is crazy and somehow, we think we're going to land the best young player in the world for a ""reasonable"" fee.

I'm just confused how the club haven't evaluated the situation and said ""Let's be honest, we can't put all our eggs in the Bellingham basket.  Let's sit down and figure out something else.  If somehow we do sign him and we've already signed a few other players, it's not like we couldn't sell a player or two to balance the budget / squad balance.  If you have good players, other clubs will want them and as we are well aware, it's not like other PL clubs don't have money.  Bournemouth is spending 25-30m on players these days.",Liverpool,No,j6rhj9p,t3_10qm41m
"God I miss the days when I was bored beyond belief between games, waiting like a little child for the next one. The anxious feeling before a match and the relief after getting points on the board. 

I’m losing track of time now, weeks are going by quicker. Realised we were playing Brighton on the day.",Liverpool,No,j6u95l1,t3_10qm41m
Any bets on who the first journo to put a piece out on our window will be (and what the narrative they'll run with is going to be)?,Liverpool,No,j6r8ri6,t3_10qm41m
"Wanted to discuss a point many people make regarding recruitment. This is central to us potentially signing Jude this summer.

I have been hearing for years that Player X won't go to Club X if they're not in the champions league next year. 

How much impact does this actually have on signing a player?

Personally, I feel like pundits put too much stock into this factor. I could be wrong but a high weekly wage and playing time at a top club seem way more important.",Liverpool,No,j6ulykc,t3_10qm41m
Oh the irony of receiving a “LAST CHANCE” mail from the club yesterday urging ME to spend money.,Liverpool,No,j6qwsuh,t3_10qm41m
"On the upside, if we miss out on CL, we all have an extra year to learn this dumb new CL structure before we’re emotionally invested in it.",Liverpool,No,j6so2ck,t3_10qm41m
Anyone else concerned that the atmosphere gets so miserable that Klopp actually leaves by the summer? I know it’s unlikely but with form as it is I do worry.,Liverpool,No,j6r9qoj,t3_10qm41m
"Zone7…..

![gif](giphy|UvtKiyeWYEhRC)",Liverpool,No,j6rz0zx,t3_10qm41m
"Chelsea have signed another player. A 16 year old academy player from Southampton for £6m…

When will it end",Liverpool,No,j6s4akv,t3_10qm41m
"Sabitzer was a huge Gerrard fan: https://www.telegraph.co.uk/football/2023/02/01/manchester-united-marcel-sabitzer-liverpool-steven-gerrard/

I can't believe we didn't try for a loan for him and United worked it out in a day.",Liverpool,No,j6th71k,t3_10qm41m
"Copium for the day: 

The lack of critical signings but Klopp generally appearing to be at peace lead to me hope a takeover is closer along than anyone else knows at this point. Klopp might know this year is going to be a wash but if a new owner brings in a squad rebuild akin to what Chelsea is doing might make up for this year. 

Miss the One Kiss vibes, that feels like an eternity ago.",Liverpool,No,j6t5sxw,t3_10qm41m
Liverpool has to be the only club who refused to built a dynasty having the best coach in the world,Liverpool,No,j6rcxp8,t3_10qm41m
"Its a shame we couldn't stave off this decline one more year. Once the new CL rules kick in, we'd be in by default no matter where we finish in the table. Gotta love that coefficient.",Liverpool,No,j6t53g8,t3_10qm41m
anyway that's going to be really awkward for caciedo going back to training at Brighton now.,Liverpool,No,j6r6ior,t3_10qm41m
"Lynch said  talks are currently held with Qatari, Germans, US, Saudi investors. I'm interested to know which German billionaire could afford us ? and I'm not gonna lie Klopp under a German ownership who can spend is making me excited.",Liverpool,No,j6tgz5m,t3_10qm41m
"Watch us not clinching a CL spot this season and you can bet the narrative in the summer will be how we can’t afford anyone because of the revenue loss.

The lack of ambition is really like really getting on my nerves.

We had the chance to cement our spot on the very top of world football with the best manager there is but ultimately failed to do so. It’s just a tad heartbreaking because the question will always be “what could’ve been?”.",Liverpool,No,j6r2wq7,t3_10qm41m
"Bobby should be let gone in the summer. He’s clearly picking up more injuries than usual, is obviously dropping off, and can allow our actual signings to develop more.

He’ll be another year older, and as much as he’s gave, it’s probably time to let go now after this season

Clinging on to players who’ve gave us great memories in the past will be our downfall, as it’s proving this season",Liverpool,No,j6r9lyv,t3_10qm41m
"If Aurther Melo turns out to be the Prince that was Promised, I'm going to laugh so hard I might just get commited to the loonly bin.",Liverpool,No,j6revnp,t3_10qm41m
So all our eggs in the Bellingham basket. Hope there's a plan B if we don't get him and by that I dont just mean Nunes from wolves,Liverpool,No,j6r5k5i,t3_10qm41m
I feel like fans are in the dark regarding Liverpool. The sales process has dragged on too long without any real update. This has seemingly affected our January transfer window as well. Not even looking for signings but just some clarity on where we are as a club right now.,Liverpool,No,j6t2jes,t3_10qm41m
Bobby knows he’s lower down the pecking order when everyone is fit and if his wages reflect that then I don’t really see an issue with it tbh. Our forward line is fine for the next few years,Liverpool,No,j6u0hsa,t3_10qm41m
It's my birthday today. Just want to send positive thoughts to everyone. up the reds,Liverpool,No,j6uj76g,t3_10qm41m
Realistically we need 3 midfielders minimum and a new CB. Possibly a new backup GK as well. I’m possibly leaning towards a new RB because it’s quite clear the Ramsay project won’t be ready for possibly another season minimum,Liverpool,No,j6r7qiz,t3_10qm41m
We're playing scrabbles when everybody is playing monopoly...,Liverpool,No,j6rzaes,t3_10qm41m
"Rumours flying all over the place tonight. Ben Jacobs saying Harris Blitzer is interested. 

Judging by the fact he has a net worth of about 5 billion I'm not sure that'd end well.",Liverpool,No,j6uifoc,t3_10qm41m
"Say we beat Madrid and Milan manages to beat Tottenham. We get matched together for the quarterfinals. We both know what it's like to suffer with how our seasons have unraveled (they're owned by RedBird and just like FSG are utter cheapskates). 

Or even better: somehow both clubs manage to make it to Istanbul against all odds. Who prevails this time? Do we clone Gerrard and Dudek and Milan clone prime Maldini, Pirlo, and Shevchenko?",Liverpool,No,j6vgrfz,t3_10qm41m
"Have a good day everyone! I'm strangely at peace with the team's current situation. 

Right now all I want to see are improved performances, and at a stretch more youth players given chances. Bajcetic is a step in the right direction.",Liverpool,No,j6qwpl7,t3_10qm41m
So Chelsea just went round and made a mockery of ffp and no one batted a eye lid 600 million over a season is a joke do not care if they are on 8 year contracts bla bla bla how is everyone meant to compete with that?,Liverpool,No,j6re00s,t3_10qm41m
"We are 12 points away from the relegation spots.. that's four games.

I'm not saying we're going down, i'm just absolutely gobsmacked at how badly this season's gone to be in this place at the halfway point.. and *still* not properly reinforce the squad. This club is rotten from the inside and the rot keeps on spreading further and further, unattended by anyone. 

We won't get an opportunity like the Coutinho sale anytime soon, which was a generational rip-off done to a generational idiot in Bartomeu. Teams like Bournemouth and Sheffield Utd have figured out that paying 20-30m for our leftovers isn't the smartest tactic. So, for a club with a staunch sell-to-buy philosophy, where will the money for the incomings come from? There isn't even anyone really worth selling these days, even the players you'd consider world class are getting on in age.

This club is absolutely fucked if FSG stays in charge. The prospect of it scares me to no end, to be honest. We'll reach the point where just challenging for 4th would be a good season. Europa League a decent year.. can't turn your nose up at the Conference League either can you? A slippery slope.",Liverpool,No,j6rcji1,t3_10qm41m
Utd have so many players who are cunts.,Liverpool,No,j6twg08,t3_10qm41m
I hope we can call this FSG's last transfer window,Liverpool,No,j6qzb0c,t3_10qm41m
"I’m really sick of it tbh. I started supporting this team 20 years ago and I experienced the downfall with Rafa, the hodgons era, the little glimpse of hope with Brendan Rodgers but then the disaster season without Suarez. It was really fun so far with Jürgen and I don’t want any other manager ever for this club. I really love him. But it’s freaking exhausting watching Liverpool being that good and not work further on it.  Without Klopp we wouldn’t have won all these trophies but we could’ve built a Dynastie and it’s sickening to see how every other team invests in their team. I don’t say that it’s good investment everywhere but I think that at least many PL teams try. Of course I don’t want any oligarchs to be our new owners but I got really sick of FSG tbh. We were always one transfer behind of being absolutely perfect. But now it feels like we have to rebuild the whole team which won’t happen with fsg ever. We need 3 midfielders, one defender, one right back bc Ramsey doesn’t exist, one back up for Salah and that just for the next season. Without new owners this seems really unrealistic…
And sorry for the negativity! I just needed to vent",Liverpool,No,j6rcwi4,t3_10qm41m
Can’t believe we proved Neville right when he said he wasn’t worried about us being good for a long time because he knows FSG won’t support Klopp. He is also writing nonsense saying this year is an off year when 20/21 happened 2 years ago smh. The club from top to bottom is broken and Klopp with the players are Thrown to the wolves,Liverpool,No,j6rnnxb,t3_10qm41m
"I found this tweet interesting. Every team that’s partered with this company (Zone7 AI), is now having an injury ‘crisis’. Including Liverpool. 

https://twitter.com/swearingpoet/status/1620769474319368193?s=61&t=pKFvm2r_Kzp4EX6R1YOBCA",Liverpool,No,j6rwlmn,t3_10qm41m
Chelsea spending more in 2 windows than Edwards ever did but people still want to dance around and call us net spend kings. Times are changing. Forest can even spend more than us despite being in the championship a year ago.,Liverpool,No,j6qw3rj,t3_10qm41m
"I’m scared to check this sub now a days lol everytime I do, someone new is injured. Konate being the latest lol",Liverpool,No,j6rr0xq,t3_10qm41m
"From today, I will treat myself with a cheat meal anytime we win a game. If we lose, I'm skipping the next meal. 

# ProjectAbs2023",Liverpool,No,j6r54wu,t3_10qm41m
Please come and save us German consortium. I beg you.,Liverpool,No,j6tkiqs,t3_10qm41m
only 1 win in january. what a month,Liverpool,No,j6qxkpi,t3_10qm41m
"One season riddled with injury is bad luck

2 is active failure from the staff.",Liverpool,No,j6r7yr8,t3_10qm41m
"Man City  
Arsenal  
Man Utd  
Newcastle  
Tottenham  
Chelsea (if their signings work out)

We went from being (along with Man city) the two best teams in the league BY FAR, to having 5, potentially 6 teams ahead of us just in one season

If you don't spend in this league, you will eventually get left behind

The future for this club is really not looking good if things continue as they are",Liverpool,No,j6s2tna,t3_10qm41m
"Dream scenario: we dick Madrid, PSG and Napoli. Play City in the final and come back from 3 goals down with Nunez scoring the winner. Is that too much to ask.",Liverpool,No,j6tr9g5,t3_10qm41m
It’s a lot of money but I believe Enzo is going to be really really good.,Liverpool,No,j6rzx25,t3_10qm41m
I think it's clear Liverpool do not have any aspirations to do well this season. If that  wasnt the case we would have signed a mf in january. it's as simple as that,Liverpool,No,j6rsu33,t3_10qm41m
https://twitter.com/TheBoatAshore/status/1620418195655106564?t=Zcsa-_jdKJqalWASp8xMLQ&s=19,Liverpool,No,j6rs0wk,t3_10qm41m
"Wasn't listening to an interview with a family member of a Hillsborough victim on LBC earlier on. Absolutely heart-wrenching, you could hear the pain emanating from her.",Liverpool,No,j6s93np,t3_10qm41m
"I have been released from jail, you may consider me....

&#x200B;

a new signing",Liverpool,No,j6r7wt4,t3_10qm41m
"Ndicka should be a priority in the summer. Rejected a contract so he's free in the summer. Quick, strong, tall, eye for a goal, left footed young french CB. 

Exactly what we need. 

Being free is so good as well since we can save money to use on the midfield rebuild. Phillips and matip/ Gomez finally get moves away.

He's missed 8 games in 4 years which is great to hear",Liverpool,No,j6u7cfx,t3_10qm41m
"Arabic reporters saying that it's a Qatar-saudi done deal, with private companies, and FSG keeping a small stake,

 feel like something if it's going to happen will happen sooner rather than later

They will want to get in before the summer transfer window",Liverpool,No,j6u9fsm,t3_10qm41m
I just can't see Enzo flopping at cheslea. He's such an all rounder and can do everything very well. I hate that he's gone Chelsea.,Liverpool,No,j6ruljr,t3_10qm41m
"Ounahi (midfielder, shone at the World Cup for Morocco, moved to Marseille for £8m a few days ago) has, perhaps inevitably, just scored a fine goal on his debut for his new team.",Liverpool,No,j6tizeo,t3_10qm41m
[removed],Liverpool,No,j6r8cjf,t3_10qm41m
is Mounts contract done in the summer or he is going to last year?,Liverpool,No,j6rnh8m,t3_10qm41m
"That Zone7ai stuff is very interesting. Seems like teams that start using it have a very good first season, fitness wise, and then everything collapses in the 2nd season.",Liverpool,No,j6swmkl,t3_10qm41m
"I genuinely believe the current model works well when you are trying to build a team from 0. You sell young future stars and hope to find diamonds in the rough. Problems start once you are on top. Do you really want to be selling your best stars in their best form to try and rebuild the team. This is where the problem of players overstaying. It’s easier to hunt but harder to stay on top. Theoretically we should have bought the Milner,Henderson,Gini successors already and then by next season they can take up major minutes.",Liverpool,No,j6t6cra,t3_10qm41m
Few rumours now that Newcastle are after Jude for the summer,Liverpool,No,j6ugqab,t3_10qm41m
"“Friendship ended with ~~QSI  QIA~~”

“Now ~~QIA~~  PIH is my best friend!”",Liverpool,No,j6ugw7h,t3_10qm41m
"My current copium is that FSG would not want to allow their asset to be left permanently out of Top 4 and miss the sweet CL revenue so they are going to sanction a big summer WARCHEST. 

I'm a proffessional clown btw",Liverpool,No,j6qzxk0,t3_10qm41m
"You know things are bad where places like RAWK"" Red white Kop"" one of the most pro FSG Liverpool fan forums are also having a meltdown and calling out the FSG.",Liverpool,No,j6r5mvk,t3_10qm41m
"Maybe I'm crazy but I feel like the Bellingham business has all been agreed and has been since summer or fall. I don't mean like secret paperwork, but like a ""gentleman's agreement"". There's too much smoke for there not to be a fire.",Liverpool,No,j6rcazg,t3_10qm41m
12 years since Torres broke my heart.,Liverpool,No,j6t3kkl,t3_10qm41m
Nunez is doing some NFT shite on twitter,Liverpool,No,j6tu9em,t3_10qm41m
I think we'll beat Madrid. If we have more options upfront with Jota coming back and a full house at Anfield I think we can do it.,Liverpool,No,j6to2pc,t3_10qm41m
"James Pearce complains about the abuse he gets on twitter. His latest tweet is about how FSG have (and I quote) ""committed £200m over the last 12 months""

I can't even with this guy. Even if you (incorrectly) ignore the fact that Sadio Mane, Neco Williams, Divock Origi (free, but wages off the books), Takumi Minamino and Marko Grujic were all sold to fund these transfers, it's still such a dumb take.

I'm convinced he's just doing it for clicks at this point. Nobody can be this dumb.",Liverpool,No,j6rde60,t3_10qm41m
"Said it before and I’ll say it again; there’d be fucking riots at Old Trafford if they had our owners.

Don’t know why we sit on our arses and accept it.",Liverpool,No,j6r1xv4,t3_10qm41m
"https://preview.redd.it/x45r1wwqxlfa1.jpeg?width=500&format=pjpg&auto=webp&v=enabled&s=0c5cc313ea2fa0893b68d191b023881ed670a778

Day 19 of posting this until we sign someone (we've been in need of a midfielder for at least 4 years)

guess which team(s) signed a new midfielder",Liverpool,No,j6rkqgy,t3_10qm41m
"Klopp knows this season is a write off, just as the players will know it too. However, he can’t admit it out loud, and will now have the damnable task of motivating confidence bereft players day in day out when they know as well as he does that they don’t have the resources to reach their goals.

The rest of this season will be an absolute shit show, similar to what we’ve seen so far since the World Cup break. The only thing that can save it is a takeover, which will at least give us confidence we can rebuild in the summer.",Liverpool,No,j6r0zc2,t3_10qm41m
"Folks, where do you see ourselves at the end of the season? I don’t see it getting any better. 10-12th place finish is most likely for me.",Liverpool,No,j6qzzs7,t3_10qm41m
"I feel people talk more and more about the business side of football than before? Or am I misremembering? People seem to have such absurd insight knowledge in how football economics work, finance strategies and debt and stuff.",Liverpool,No,j6r0gjq,t3_10qm41m
"It's got to the point, knowing how cheap we are, I'm not even sure I'd want Bellingham if it meant that's our only first team signing.

Which is ridiculous, because if you have the opportunity to buy someone as good as Bellingham you don't miss it. But one player, no matter how good, isn't going to transform us into an elite team again... We need 3 or 4.

That's if he'd even want to join us at this point. So depressing how far we've fallen so quickly.",Liverpool,No,j6r9s6i,t3_10qm41m
"next summer, not renew milner, keita and ox, sell jones and possible sell fabinho (he has from here until summer to get to somewhat form or he should be sold aswell) that would leave hendo, thiago, elliot and bajcetic, gonna need MINIMUM 2 quality reliable players, if not more",Liverpool,No,j6t6j5u,t3_10qm41m
"Chelsea’s spending is another nail in the coffin of my love for this sport. 

35 years and football has been my life. 

Wouldn’t miss a Liverpool game ever. My job was a football coach for 15 years. My weekend was dictated by when Liverpool playing. 

Now. I’m just losing the interest. Maybe it’s finally seeing Liverpool win the league which took the edge off a bit. 

But I just can’t excited. Let’s say Arsenal do win the league. Amazing accomplishment. 

You can absolutely guarantee Man City spend £300 million in the summer to get back on top. 

Newcastle will probably have 10 subsidiaries with no employees sponsor them for £500 million.",Liverpool,No,j6qu3zr,t3_10qm41m
Please don't downvote me i'm not trying to argue with anyone but I'd still fully support the club even with oil owners. I believe it's inevitable even if its not our next owners. It's just how the sport is now unfortunately,Liverpool,No,j6r92km,t3_10qm41m
"I think a lot of people are misinterpreting Gorst’s article about sporting director. He even called out some aggregators for the same. He basically said that Liverpool will start looking for new sporting director nearer to when Ward is leaving, he will be there for the summer window and the next winter window will be under the new sporting director.",Liverpool,No,j6qxx5a,t3_10qm41m
It really feels like a sale is close from the sheer silence of everything,Liverpool,No,j6r5rvd,t3_10qm41m
"If Klopp gets top 4 with ths midfield, he deserves MOTS",Liverpool,No,j6t74k0,t3_10qm41m
"When John Henry avoided an interview on the pitch after Liverpool won the Champions League, I figured he was just an introvert or private. Now I think it's because he didn't want to be quoted on future investments. FSG investors must be pretty damn happy with their low risk high return strategy anyway ...

Edit: you can see him hurriedly ducking away from the camera and presenter when Klopp is being interviewed",Liverpool,No,j6uk38p,t3_10qm41m
"So what can we expect in the next window? 

We clearly need at least two, but more realistically three midfielders given the expected outgoings in the midfield (Keita, Ox, maybe Milner but at this point I wouldn't mind him staying as a deep rotation option) as well as the loss of form from former mainstays (Fabinho, Henderson). I'm actually still optimistic Bellingham will come *if* he wants to, and I don't think one poor season will disuade him, but the thing that worries me is Bellingham alone won't cut it and won't help us out of this tough situation in the midfield. We need at the very least one more, but preferably two more.

But add to that defense is also looking like an area of the squad we'll need to spend in as well, namely center-back. Matip doesn't look like he is at the level he was a couple of seasons ago and Gomez only provides versatility positionally but he isn't good at this point. Besides, Gomez might be one of the few players who we could sell on for a decent fee (Kelleher and maybe Curtis the only other two). We'll need to also invest in the defense at this point, and that'll be costly as well. Someone like Gvadirol would be a dream, but forgive me for being too skeptical we'll spend on Gvadirol on top of Jude or whoever Jude's back-up is (which clearly isn't Enzo now despite it being the easier deal to be done compared to other back-up targets).

So work definitely needs to be done for sure. Midfield is the clear hole and clear issue that needs to be resolved in the summer, but with defense looking like an area that can't be ignored as well, it does leave me with a bit of worry on whether or not we can spend enough to be able to replenish the squad and add new pieces.",Liverpool,No,j6r16gl,t3_10qm41m
"To take a break from fuming about the latest wasted transfer window, random question—has anyone in the US been able to get ahold of the commemorative LFC Carlsberg cans? There was a big splashy announcement and I’ve kept an eye out but haven’t seen one in the wild or any real talk about it.",Liverpool,No,j6sy0s4,t3_10qm41m
"I look at City as to how rebuilding a team is not so easy. They got rid of Sterling,Zinchenko and Jesus (While Sterling really pushed for a move away since last season). They bought in 2 attackers who are different profiles compared to the ones they sold while not really getting an adequate LB. The numbers can never predict the sudden decline of your players in one summer and that’s what happened to them as well. They probably thought their current players can sustain their current levels while trying a new system but seems they forgot that not every player is built for a certain system. Interesting how LFC and City are suffering rebuilding problems but in different ways",Liverpool,No,j6t72bj,t3_10qm41m
"The good news is that Sepp and Jones are allowed to take HG spots next season. So when we buy players next season, we don’t necessarily have to be pursuing HG only.",Liverpool,No,j6t8cgs,t3_10qm41m
"If any other top 6 club had our owners, there would be protests, imagine Utd fans with FSG owners? You think they would put up with it. 

I'm stunned with the unwavering loyalty the fanbase has to FSG. I'm honestly wondering why? 

The lack of ambition from them is heartbreaking in all honesty.",Liverpool,No,j6r5s0b,t3_10qm41m
"There's speculation that we're looking at getting Kante in the summer of a free. Great. We're Retirement Home FC now. Few years ago, would've been class, but his injury record lately has been abysmal.",Liverpool,No,j6s2sto,t3_10qm41m
"The Conference League looks hilarious. Just had a look at some of the teams that qualified for the group stage this year.

The top scorer for this year plays for 'Dnipro-1'. Literally sounds like a file name. We should win it for a laugh. 

I'm all in for a PL+CL* double next year with the new owners and Bellingham.",Liverpool,No,j6sr8wo,t3_10qm41m
