Comment,Club,Reply,comment_id,comment_parent_id
My absolute favorite moment from yesterdays match was when that washed up Lemina guy was dancing around our players just outside his own box and Bajcetic went flying in with a slide tackle to win the ball back. That kids got more tenacity and grit in him than most of our senior players.,Liverpool,No,j7abeve,t3_10u5d54
Turns out it was origi who was holding this club together,Liverpool,No,j7a2sqr,t3_10u5d54
Wolves’ third goal starts from a 36-year-old Joao Moutinho harrying Gomez and Bajtecic to win the ball. There isn’t a team in England who wouldn’t relish playing us right now.,Liverpool,No,j7alm9a,t3_10u5d54
Klopp snapping at Pearce seems to me it’s not only about Pearce’s articles. Pearce has been in many press conferences but he hasn’t snapped at him. The problems on the pitch and the problems in the background surely have to be taking their toll on him?,Liverpool,No,j7a9sl2,t3_10u5d54
Imagine how toxic things are going to get if Everton beat us at Anfield,Liverpool,No,j7azepy,t3_10u5d54
"I actually would like to know what the club did over the winter break for us to come back looking so much worse

We weren't perfect but we actually were winning some games here and there, and scoring goals

Wtf happened over the winter break???

We don't even look like we are capable of winning games at this point, let alone actually score a goal

Ffs our highest goalscorer since the new year is a Leicester defender 

There must be something going on behind the scenes I assume, the club is very toxic currently and feels like either Klopp or FSG will have to leave for things to get better again",Liverpool,No,j7bcrc9,t3_10u5d54
klopp really said that 3-0 against brighton was the worst but our players showed they can be even worse,Liverpool,No,j7a53yt,t3_10u5d54
Enough of the “city would’ve smashed spurs if we were top” narrative. City got 0/6 from spurs last season,Liverpool,No,j7ch8ji,t3_10u5d54
The fact tht nunez have to urge salah to press with him a few time last night is concerning..,Liverpool,No,j7a7rsd,t3_10u5d54
"Remember that 9-0 against Bournemouth? Seems like a long time ago now.

And in 3 consecutive away games we have almost completely wiped out that GD.",Liverpool,No,j7aa1vy,t3_10u5d54
"“US investment firm Red Bird Capital Partners consider upping stake in Liverpool, a move which could earn FSG £1bn and allow them to retain ownership of Merseyside club”

FSG have also held preliminary talks with other interested parties including the Qatar Investment Authority.

It is understood QIA would prefer to buy a controlling stake in Liverpool, while FSG have signalled their preference for the sale of a minority share initially”

From Alex miller who is supposedly reliable. Incredibly underwhelming if the redbird investment happens",Liverpool,No,j7abwoh,t3_10u5d54
"The only thing I’m confused from Miller’s article today is that, he said FSG are watching United’s sale and if they sell for a higher price then they will up our price as well. When they are already struggling to get suitors for £4b, how will they find anyone to buy us for a higher price?",Liverpool,No,j7ampt3,t3_10u5d54
Liverpool and City pretty much sucked the life out of each other over the last four years,Liverpool,No,j7c6elu,t3_10u5d54
"This season is a opposite of 17/18, we had a great team but shit keeper now we have a great kepper but shit team",Liverpool,No,j7cjxli,t3_10u5d54
"My wife sometimes randomly used to watch matches with me whenever she had time on weekends. She is a total novice when it comes to any sport and has no idea about all the sports. Last night was the first time when she sat down to watch a Liverpool game with me this season. Within first minute she asks me why does everything look to messy, Liverpool used to look so organised since the first minute. After 15 minutes, she said this looks painful to watch and left.

Now we all know the transfer issues and have beaten that drum enough. But in the end, the players on the pitch should be doing better and I don’t understand what kind of tactics Klopp wants to implement. We brought Nunez who forced a total change in style. Our wingers don’t operate in half spaces anymore but instead hug the touchline all the time. Then after the world cup, he went back to using the false nine for better pressing and defence from the front. But last night he went back to Nunez as a striker. I don’t see any passing triangles, any structured movements to open spaces. And it seems like Klopp is unable to figure out what will work right now.",Liverpool,No,j7a5a46,t3_10u5d54
"Our Rivals watch can no longer be the likes of Tottenham vs Man City. It’s now Brentford, Brighton and Fulham games :P",Liverpool,No,j7bu1he,t3_10u5d54
"Madrid lost to Mallorca today, it’s annoying how in the season where they’re shit we are even worse",Liverpool,No,j7cl41c,t3_10u5d54
"The Alex Miller article also states that FSG will try to use the Manchester United sale to price us up even more.

In the past 12 months, FSG have:

Removed Mike Gordon behind the scenes to facilitate a non-existent takeover.

Hung Klopp out to dry with minimal backing and has spent less than the majority of Premier League clubs.

Priced out virtually every consortium that has had interest due to their ridiculous demands.

Used the club's income to pay off their infrastructure loans instead of using it to fund transfers.

Clearly have not helped us establish our ongoing problems with recruitment, establishing roles within that, have not found a replacement for Julian Ward thus far. As well as letting our top data analyst leave without a replacement.

And now are willing to gain 'strategic partnerships' with Redbird or whoever else, to further fill their pockets.

We are run by snakes and they are eating the club inside out.",Liverpool,No,j7ailu9,t3_10u5d54
"In terms of my love of football, I currently feel like a dying man on life support and the only thing that can revive me is FSG fucking off. The small hope of those bastards leaving is what’s keeping me alive.",Liverpool,No,j7azjnr,t3_10u5d54
"City are on course for 80 points, forget the bullshit they put up when we were up there, cunts.",Liverpool,No,j7c5860,t3_10u5d54
Pep just wants his buddy to win the league.,Liverpool,No,j7c51co,t3_10u5d54
Mods should stop the Goal of the Day atleast for some time. It’s just outright depressing tbh.,Liverpool,No,j7ae73d,t3_10u5d54
"Was about to come and hate on Carra. Saw his full comment and he is kind of right. We had money to sign a midfielder, we didn’t sign Tchouameni and then signed no one afterwards. Everyone knows the club decided to use that money into the Jude fund instead of buying someone last summer which I think is idiotic.",Liverpool,No,j7cj8p3,t3_10u5d54
"LFC fanbase: this has been hard, all the news about the BTS issues, no signings, bad performances. We sure could use some good news! 

News: Redbird looking to up their stake! FSG still wants to be in control. 

LFC fanbase: 😫",Liverpool,No,j7al0oj,t3_10u5d54
Madrid really are poor this season. I fully expect them to get knocked out of the champions league quarter finals.,Liverpool,No,j7b8v86,t3_10u5d54
"Just want Luis Diaz back. I don't even know if he is enough to help us, he's just fun to watch and god I need that",Liverpool,No,j7a9ii9,t3_10u5d54
"That win against city in the community shield at the start of the season feels like years ago. I genuinely don’t understand what happened in between that game and the Fulham game. In the community shield game we looked like normal Liverpool, everyone was playing well and we had so much energy. Then we play Fulham and everyone’s form went to shit and it seems like half our players can’t run anymore. I know people say that we don’t become a bad team overnight but it genuinely seems like we did",Liverpool,No,j7c1it9,t3_10u5d54
"The 2 seasons City drop off, we decide not to invest in the most obviously lacking areas of the squad. Worst of all, in both cases, we got second chances in January to fix the summer mistakes, but didn’t…

So cringe to think about 🤦‍♂️",Liverpool,No,j7c4jqu,t3_10u5d54
I've always thought FSG were shrewd. Like obviously isn't great having them as our owners but credit where credit is due they're good businessmen. But if we end up losing Klopp because they didn't put a measly £30-60m into a new midfielder or two then it shows they're completely fucking myopic.,Liverpool,No,j7ax2nk,t3_10u5d54
"Fucking hell, Forest are only 5 points behind us. Yeah we’ve played a game less but not like that means much right now.",Liverpool,No,j7bju2d,t3_10u5d54
this city team is declining too and in dire need of reinforcement in few postions next summer. just shudders thinking of how much they'll spend next summer,Liverpool,No,j7btxhe,t3_10u5d54
"I just looked at the table and saw that we’ve won 8 games this season, when did we win 8 games? Lmao.",Liverpool,No,j7aoer7,t3_10u5d54
Hoping Leeds and forest draw so it gives us a better chance of staying up,Liverpool,No,j7b4lwg,t3_10u5d54
"you know i guess i was wrong about van dijk - after his injury, things have gotten even worse haha",Liverpool,No,j7btyii,t3_10u5d54
"I think protests are reasonable thing, if this redbird investment gets traction",Liverpool,No,j7bz9yb,t3_10u5d54
Why does grealish always look so confused? Man seems brain dead.,Liverpool,No,j7c55fu,t3_10u5d54
We are going to get beaten by Everton aren't we,Liverpool,No,j7agwr8,t3_10u5d54
So it is increasingly likely FSG is playing hardball and letting prospectful bidders go away and holding the club hostage.,Liverpool,No,j7aip9o,t3_10u5d54
"I think the weirdest drop off for me this season has been how abysmal we now are at set pieces. 

Being slow to press you can blame on fatigue, decline or no reinforcements, but players who routinely formed one of the best back lines in the world now look like they can't handle any aerial ball.",Liverpool,No,j7aipj6,t3_10u5d54
"it's like overnight, right after losing the champo final, the whole squad turned into mercenaries, won't run, won't defend, won't try to even win second balls

honestly saddened by how dejected klopp is, can't wait for the clean out after this season",Liverpool,No,j7afw9e,t3_10u5d54
It’s amazing if you look at the Red Sox sub - those guys are saying the exact same things we do.,Liverpool,No,j7bxxaa,t3_10u5d54
Remember that moment we all thought Alisson was taking it into his own hands? Lol,Liverpool,No,j7a52h7,t3_10u5d54
"If we had truly gone out and aimed to win the league at any point then we'd have never experienced 20-21 and 22-23. The fact is we were always happy to cruise to a comfortable CL finish and 19-20 was a happy accident which happened in spite of FSG's strategy, not because of it.

When you're in a competitive environment you always need to aim higher and try to innovate and push your opposition. Resting on your laurels will only lead to downfall when there are a handful of clubs aiming to take your perch.

Wouldn't be surprised if that's also a big cause of our mentality issues, it's hard for players to feel motivated when the club doesn't appear to be pushing to win trophies. People like to be in a forward-thinking environment with room for personal and collective growth, not in a team whose primary aim is to cling onto second place. 

Right now all of the Arsenal, Utd and Newcastle players are looking forward to what they're going to accomplish in the future, we just don't have that. We're looking at what we accomplished in the past.",Liverpool,No,j7arhmz,t3_10u5d54
I’d like to see more of Ben Doak and Calvin Ramsay at this point. Nothing to lose really,Liverpool,No,j7az3b4,t3_10u5d54
"The last match was the final cry for help for this team, a rebuild is the necessity of the hour.

Idk which players can fix this situation, but I think everyone is sure about which players shouldn't be continuing next season with the club.

Ox, Keita, Fab, Hendo, Milner, Matip, Williams, Rhys need to be offloaded asap.

Problem is except for Gomez and maybe Fab I don't think we can expect any decent amount in transfer value for the rest. So we will need major investment otherwise we're going to be looking at more of this come next season. These players are completely checked out and it's not healthy to keep them on despite the consistently mediocre performances. The motivation levels of the new players also seems to be impacted because of the lack of effort they're seeing on the pitch from the pensioners.",Liverpool,No,j7aztui,t3_10u5d54
Only thing that’s actually worked this season was the tactics we played against City in the league.  A bit less typical of a Klopp side but surely it’s worth trying again? Mindlessly continuing with 4-3-3 is insane,Liverpool,No,j7bct6d,t3_10u5d54
Crazy to think without that 9-0 against Bournemouth we would have a negative goal difference after 20 games.,Liverpool,No,j7bhkfh,t3_10u5d54
Imagine being able to not start KDB for tactical reasons,Liverpool,No,j7bk4mj,t3_10u5d54
City also hit that cycle to rebuild the team like us. The different is they have many quality backup players. Even they have a bad season they still can compete. Next season we probably see big spending from them again.,Liverpool,No,j7c92nm,t3_10u5d54
We would’ve smashed the league this year if we were the same team we were last year.,Liverpool,No,j7d1lrk,t3_10u5d54
Got downvoted for saying Robbo should've done better for the second and third goal. I sometimes wonder whether people here even watch the game or do they just camp here to downvote any criticism directed towards our players. Seems like a lot of people here just want to toot their loyal fans bandwagon and not even slightly interested in the clubs overall wellbeing.,Liverpool,No,j7aabu8,t3_10u5d54
Everton next. If the players play like that vs the blue nosed twats the fans will riot.,Liverpool,No,j7acopu,t3_10u5d54
"The lads at the local tip think the writing is on the wall for Klopp, especially after ""losing his mind"" yesterday.

General consensus is that our team is shite, right? Klopp isn't perfect, but I fail to see how any manager could work with what we've got.",Liverpool,No,j7b96pw,t3_10u5d54
"Can’t we just try defense, counterattack…. We absolutely suck trying to do this fancy City shit these days",Liverpool,No,j7chw2r,t3_10u5d54
"In the next 2 seasons we need to replace VVD, Matip, Gomez, Keita, Ox, Thiago, Hendo, Milner, Salah and Firmino at the very least. 

It is going to be hell if we don’t spend any money and we really need to sell 3-4 before they are unsellable.",Liverpool,No,j7ahky7,t3_10u5d54
"Do I think he’s a savior? No. But Doak’s cameos have been some of the most exciting and electric performances in this very shitty season, as you can clearly see a hungry player, who is aiming to make something happen. 

We need a bench full of Doaks is all I’m saying.",Liverpool,No,j7blppp,t3_10u5d54
"Spurs helping rivals win the league, so spursy",Liverpool,No,j7c19nf,t3_10u5d54
"FSG and all their mates need to just go now. I think it was very very clear they thought FFP would change the game and their business like approach would work and to be fair to them it would have. Our signings have a hit rate of like 80/90%. 

But Chelsea have just spent in 6 months the same amount as we’ve spent under Klopp. FFP doesn’t work. City, United, Newcastle, Chelsea and even Arsenal are going to buy a fucking shit ton of players in the coming years. We will fall further behind if we carry on.",Liverpool,No,j7alku0,t3_10u5d54
So Arsenal losing against relegation fodder goes unpunished but when we win 16 of the last 18 we still finish 2nd in the most devastating fashion. Tired of footy at the moment,Liverpool,No,j7c7exz,t3_10u5d54
"Am i the only one annoyed by Nunez finishing ?
people calling him  a bright spark but him missing so many chances at crucial time is not helping either",Liverpool,No,j7a8ywm,t3_10u5d54
"If the players don't stop sulking and they put in another shite no effort performance against Everton, think the crowd reaction won't be pleasant. They'll get a well deserved verbal arse kicking.

Can't remember ever feeling so disconnected to a group of players since the Hodgson days. Would happily see 90% of them sold or released.",Liverpool,No,j7awp3h,t3_10u5d54
"Wout Faes is our top goal scorer since December 30 ... he plays for Leicester 

I know we all say how bad the midfield is and they are but that front line right now is shocking!",Liverpool,No,j7bki6y,t3_10u5d54
"Has Guardiola fallen out with more players? Ruben Dias seemed like their best centre back and a proper leader last year?



Dias and De Bruyne both dropped.",Liverpool,No,j7bnsaz,t3_10u5d54
"If it wasn't for Liverpool and Chelsea, people would be talking a lot more about City's form and Pep's personnel decisions.",Liverpool,No,j7bzyqg,t3_10u5d54
City have already lost lore this season than all of last season.. 🙂,Liverpool,No,j7c5xkd,t3_10u5d54
"Anyone watching Barcelona vs Sevilla?

Holy fuck Barca is good. Feel like every single of their players is so dynamic and also able to beat their men. Very creative, they work hard. Mad how shit their team was just 1 or 2 seasons ago and now they have all those fantastic players

They switch so fast, are really creative. I miss our team playing similar lol",Liverpool,No,j7czsvr,t3_10u5d54
"Imagine Kane in this City team, would get the same amount of goals as Haaland, but with brilliant passing and link up play to go with it.",Liverpool,No,j7c5cqp,t3_10u5d54
I love Klopp that is all,Liverpool,No,j7cgsb0,t3_10u5d54
Really really really wanna see a more pragmatic approach and a deeper defensive line with more players commited to defending. Decrease the amout of chances we concede -> increase the chances we keep a clean sheet -> points -> confidence boost.,Liverpool,No,j7a9mag,t3_10u5d54
[removed],Liverpool,No,j7agqoj,t3_10u5d54
Nottingham Forest are 5 points behind us for fucks sake. Would love an explanation from the club as to how this has been allowed to happen,Liverpool,No,j7bcgvc,t3_10u5d54
El Bottleco,Liverpool,No,j7bqbaz,t3_10u5d54
Pep and Klopp suffering tactical problems with their teams. Both managers starting 18 year old starlets since WC ended. Maybe they are more linked than we realise…,Liverpool,No,j7c3hcv,t3_10u5d54
Spurs game plan to frustrate City worked perfectly. So much time wasted arguing. Love to see them throwing tantrums,Liverpool,No,j7c4sdb,t3_10u5d54
Start blooding more of the young guys if established pros are not doing it,Liverpool,No,j7ctd4d,t3_10u5d54
"If by some miracle we manage to win the CL this year, promise me that you will all be insufferable bastards because I’m going to be in sensational form. 🙏🙏🙏",Liverpool,No,j7d3mnk,t3_10u5d54
"Letting Cancelo go to Bayern, who has two assists already fyi, and not starting De Bruyn in a must win game against spurs, makes me thing Pep couldn’t care less if arsenal win the league. But gives it his all when he’s up against us. What a joke man.",Liverpool,No,j7cwpdn,t3_10u5d54
"The quality of the league as a whole has dropped big time this year it seems, Arsenal really aren't that great either they are just standing out since everyone else is shit.",Liverpool,No,j7c4ytd,t3_10u5d54
"The Redbird rumours are literally the worst case option,  they under are investigation for the way they bought AC Milan, for embezzlement! We will not see a penny",Liverpool,No,j7aebyp,t3_10u5d54
Wonder why we went away from the box 4-4-2 from earlier in the season. Wonder if Jota and Firmino returning to training may aid us in returning to that. We look worse Post-WC.,Liverpool,No,j7a9vni,t3_10u5d54
when was our last corner goal? we had pretty much a lot pf corners these days yet can’t remember scoring one,Liverpool,No,j7amsb2,t3_10u5d54
"Watching even fucking Everton show more effort and commitment (3 players at once charging down shots) than our players is depressing. In fact, it’s a disgrace. We got our asses handed to us by the 18th place team in the league. We’re probably the worst team in the league right now and say what you want about old players, investment etc. (all valid), we also have a group of players whose egos and self importance haven’t caught up to the new reality of their legs not being able to do what they once did and who think they can just stroll around and are too important to do the bare fucking minimum of sweating for the shirt.",Liverpool,No,j7atp6w,t3_10u5d54
Okay where is Carvalho?,Liverpool,No,j7b7n62,t3_10u5d54
Tbh given how shit we are it's hard to think just how bad we're gonna be when Thiago picks up his inevitable injury after being ran into the ground.,Liverpool,No,j7b8qed,t3_10u5d54
"Real Madrid are not that good, but I just can't picture us winning a football game at the moment.",Liverpool,No,j7b9zbq,t3_10u5d54
City really wants to give the title to arsenal.,Liverpool,No,j7bq632,t3_10u5d54
this rico lewis kid is special.,Liverpool,No,j7bs1lh,t3_10u5d54
"Klopp should start a gofundme himself so he can collect funds for this summer. As things look, it's unlikely fsg will issue funds for more than one player",Liverpool,No,j7bze4a,t3_10u5d54
We really need to talk more about what a load of nasty whingebags the City players are,Liverpool,No,j7c1wto,t3_10u5d54
*Inhales hopium* us playing shit is just to lure Madrid into a false sense of security so we go on to win the UCL,Liverpool,No,j7cogg3,t3_10u5d54
Not looking forward to being beaten by Madrid Again. For a club with the pedigree and prestige they have they’re so classless when they win. I’d rather not lose to them again but I know it’s going to happen.,Liverpool,No,j7d8ify,t3_10u5d54
"It sucks that city need a midfield rebuild in the same summer we do. No doubt they will go all in for Jude (and probably get him cause at least them sucking still has them ending in top 4), and probably all our other targets too.",Liverpool,No,j7cjltp,t3_10u5d54
So we going to end up with not only 1 FSG but 2 FSG’S. I'm getting depressed about the whole situation.,Liverpool,No,j7akwfi,t3_10u5d54
"Why are people convinced Klopp attacked Pierce, because of him being FSG's mouthpiece? Klopp is probably FSG's biggest public defender, like it or not. 

I think it's much more likely Jurgen isn't a fan of multiple publications, including The Athletic that James works for, that have posted articles implying he prioritizes certain people's opinions over medical professionals. The Athletic article (if I am not mistaken) specifically went as further as saying Klopp mostly listens to staff members that he has a personal friendship with. That's quite the statement to make. Of course I believe they probably wrote this based on the words of disappointed  former members of the staff (likely the physios), but Jurgen is possibly feeling the pressure of knowing certain journalists keep communication with them.",Liverpool,No,j7agffs,t3_10u5d54
"Fuck off, if city were chasing us down in a title race VAR would 100% give them a penalty there",Liverpool,No,j7c4ryh,t3_10u5d54
"Madrid worried about Courtois injury today 

Benzema likely out too. It’s time to pull off a madness",Liverpool,No,j7cr0f6,t3_10u5d54
I wish we could swap the results of the FA Cup game and yesterday’s game. I would have liked the 1-0 win in prem and taken the 3-0 loss in FA Cup.,Liverpool,No,j7a5ymn,t3_10u5d54
Do you fear some of our key players could want to force a move out thus summer ?,Liverpool,No,j7ahes9,t3_10u5d54
"Can anyone with a rational mind talk me into believing next season will be any different? 

We already know the club are likely to be losing Keita (good riddance) Milner, Adrian, Kelleher, Firmino in the summer. 

All of those will leave on a free (bar Kelleher) so we won’t have money to spend to replace them, so what will we do? 

Can’t see how the takeover will have gone through by the summer if we don’t already know anything about potential buyers other than nonsense twitter ITK wannabes so where’s the money for this rebuild coming from? 

We have too many players the wrong side of 30 who if we did want to sell to raise funds wouldn’t bring in what we need due to their age such as Tiago, Hendo, VVD, Salah plus selling them means they’ll need replacing also. 

The injury issue can no longer been seen as ‘coincidence’ this is our 3rd injury crisis in 4 seasons, club doctors are leaving and we are struggling to replace them, clearly something in the rumours it’s Klopp and the others training methods, assuming all of the above gets sorted and we have new owners who sign loads of players, what’s going to change to ensure they don’t all get injured? 

You look through the side and there’s so many players you wouldn’t be arsed to see leave the club, people don’t want Saudi or Qatari owners but who else can afford to come in and do what’s needed? Ie sign a whole new midfield and back four?",Liverpool,No,j7aqpaa,t3_10u5d54
Regardless of our owners being cunts....looking over our shoulder at the relegation fight is fucking embarrassing for a squad of our level. Any of the sides below us would kill to have a squad with half the talent of ours and yet we're currently the worst of the bunch.,Liverpool,No,j7az0fm,t3_10u5d54
"If it meant winning the league and champions league, I would take us being the 10th revenue drivers in world football. But FSG big win is that we are the 3rd richest club in the world.",Liverpool,No,j7b3ij4,t3_10u5d54
